{
  "$schema": "http://json-schema.org/draft-07/schema#",
  "type": "object",
  "required": [
    "id",
    "name",
    "description"
  ],
  "properties": {
    "id": {
      "type": "string",
      "description": "Unique identifier for the model."
    },
    "name": {
      "type": "string",
      "description": "Display name of task model - this is the name shown in the dropdown in the b.well AI tool"
    },
    "description": {
      "type": "string",
      "description": "This is the text shown when a user types “help” in that model's chat window."
    },
    "type": {
      "type": "string",
      "description": "Type of model.",
      "default": "langchain",
      "oneOf": [
        {
          "type": "string",
          "description": "Langchain models are models that are part of the language model gateway.",
          "const": "langchain"
        },
        {
          "type": "string",
          "description": "OpenAI models are models that are part of the OpenAI API.",
          "const": "openai"
        }
      ]
    },
    "owner": {
      "type": "string",
      "description": "This is the name of the owner of this model.  It is shown when someone types help in that model.  This is to help people reach out to owners of a model if they have questions, have issues or just want to thank the owner for creating this model.",
      "default": null
    },
    "url": {
      "type": "string",
      "description": "If we are not using the local language model gateway, this is the URL to the model.",
      "format": "uri",
      "default": null
    },
    "disabled": {
      "type": "boolean",
      "description": "If true, this model will not be shown in the list of models in the b.well AI tool.",
      "default": false
    },
    "model": {
      "type": "object",
      "description": "This is the model that is used for the task.  If you don’t specify the model, our AI will chose the default model.  This is the recommended approach unless you want a specific model.",
      "required": [
        "provider",
        "model"
      ],
      "properties": {
        "provider": {
          "type": "string",
          "description": "Provider of the model.",
          "enum": [
            "bedrock",
            "openai"
          ],
          "default": null
        },
        "model": {
          "type": "string",
          "description": "Model name.  This should be a specific language model supported by AWS Bedrock and enabled for our AWS account.  We recommend us.anthropic.claude-3-5-haiku-20241022-v1:0 unless you know what you’re doing."
        }
      },
      "default": null
    },
    "system_prompts": {
      "type": "array",
      "description": "These are the prompts that are sent to the model before any user messages. In system prompts, you can define the role of the LLM agent, provide it instructions, provide it example output and constrain its function.",
      "items": {
        "type": "object",
        "required": [
          "content"
        ],
        "properties": {
          "role": {
            "type": "string",
            "description": "Role of the prompt.  This can be system, assistant or user.",
            "enum": [
              "system",
              "assistant",
              "user"
            ],
            "default": "system"
          },
          "content": {
            "type": "string",
            "description": "Content of the prompt."
          },
          "hub_id": {
            "type": "string",
            "description": "Langhub ID of the prompt.  If set, the prompt will be fetched from the langhub.",
            "default": null
          },
          "cache": {
            "type": "boolean",
            "description": "If true, the LLM will cache this prompt for future uses.",
            "default": null
          }
        }
      }
    },
    "example_prompts": {
      "type": "array",
      "description": "These example prompts are shown when the user types help in the chat window.",
      "items": {
        "type": "object",
        "required": [
          "role",
          "content"
        ],
        "properties": {
          "role": {
            "type": "string",
            "description": "Role of the prompt.  This can be system, assistant or user.",
            "enum": [
              "user"
            ],
            "default": "user"
          },
          "content": {
            "type": "string",
            "description": "Content of the prompt."
          }
        }
      },
      "default": null
    },
    "model_parameters": {
      "type": "array",
      "description": "These are the parameters to configure the base model. ",
      "items": {
        "type": "object",
        "required": [
          "key",
          "value"
        ],
        "properties": {
          "key": {
            "type": "string",
            "description": "Parameter name."
          },
          "value": {
            "type": "string",
            "description": "Parameter value."
          }
        }
      },
      "default": null
    },
    "headers": {
      "type": "array",
      "description": "These are the headers that are sent to the URL if set.",
      "items": {
        "type": "object",
        "required": [
          "key",
          "value"
        ],
        "properties": {
          "key": {
            "type": "string",
            "description": "Header key."
          },
          "value": {
            "type": "string",
            "description": "Header value."
          }
        }
      },
      "default": null
    },
    "tools": {
      "type": "array",
      "description": "These are the tools that are available for the model.",
      "items": {
        "type": "object",
        "required": [
          "name"
        ],
        "properties": {
          "name": {
            "type": "string",
            "description": "Name of the tool.",
            "oneOf": [
              {
                "enum": [
                  "current_date",
                  "pubmed",
                  "web_search",
                  "get_web_page",
                  "arxiv_search",
                  "image_generator",
                  "image_generator_openai",
                  "graph_viz_diagram_generator",
                  "sequence_diagram_generator",
                  "flow_chart_generator",
                  "er_diagram_generator",
                  "network_topology_generator",
                  "scraping_bee_web_scraper",
                  "provider_search",
                  "pdf_text_extractor ",
                  "github_pull_request_analyzer",
                  "github_pull_request_diff",
                  "jira_issues_analyzer",
                  "health_summary_generator",
                  "fhir_graphql_schema_provider"
                ]
              },
              {
                "type": "string"
              }
            ]
          },
          "parameters": {
            "type": "array",
            "description": "Parameters for the tool.",
            "items": {
              "type": "object",
              "required": [
                "key",
                "value"
              ],
              "properties": {
                "key": {
                  "type": "string",
                  "description": "Parameter name."
                },
                "value": {
                  "type": "string",
                  "description": "Parameter value."
                }
              }
            }
          }
        }
      }
    },
    "agents": {
      "type": "array",
      "description": "These are the agents that are available for the model.",
      "items": {
        "type": "object",
        "required": [
          "name"
        ],
        "properties": {
          "name": {
            "type": "string",
            "description": "Name of the agent.",
            "oneOf": [
              {
                "enum": [
                  "current_date",
                  "pubmed",
                  "web_search",
                  "get_web_page",
                  "arxiv_search",
                  "image_generator",
                  "image_generator_openai",
                  "graph_viz_diagram_generator",
                  "sequence_diagram_generator",
                  "flow_chart_generator",
                  "er_diagram_generator",
                  "network_topology_generator",
                  "scraping_bee_web_scraper",
                  "provider_search",
                  "pdf_text_extractor ",
                  "github_pull_request_analyzer",
                  "github_pull_request_diff",
                  "jira_issues_analyzer",
                  "health_summary_generator",
                  "fhir_graphql_schema_provider"
                ]
              },
              {
                "type": "string"
              }
            ]
          },
          "parameters": {
            "type": "array",
            "description": "Parameters for the agent.",
            "items": {
              "type": "object",
              "required": [
                "key",
                "value"
              ],
              "properties": {
                "key": {
                  "type": "string",
                  "description": "Parameter name."
                },
                "value": {
                  "type": "string",
                  "description": "Parameter value."
                }
              }
            }
          }
        }
      }
    }
  }
}
