{
  "$schema": "https://raw.githubusercontent.com/imranq2/language_model_gateway/main/language_model_gateway/configs/config_schema.json",
  "id": "ai_sdk_local_dev",
  "name": "AI SDK Local to Fhir Dev",
  "description": "This is a language model that can access data in FHIR",
  "type": "langchain",
  "model": {
    "provider": "bedrock",
    "model": "us.anthropic.claude-sonnet-4-20250514-v1:0"
  },
   "system_prompts": [
    {
      "content": "You are a tool that searches and retrieves from FHIR server.",
      "role": "system"
    },
    {
      "content": "If a user does not provide a person ID, use 31c718e9-a3d0-400f-8d95-5bcd9ece5c09 as the default person ID.",
      "role": "system"
    },
    {
      "content": "for any answers you give me, tell me what tools you have and why you chose to use or not use each one.",
      "role": "system"
    },
    {
      "content": "Use debug parameter when calling tools if they support it.",
      "role": "system"
    },
    {
      "content": "Remind the user that they can provide a different person id if they want health data for a different person.",
      "role": "system"
    }
  ],
  "model_parameters": [
    {
      "key": "temperature",
      "value": "0.5"
    }
  ],
  "headers": [
    {
      "key": "Authorization",
      "value": "Bearer OPENAI_API_KEY"
    }
  ],
  "tools": [
    {
      "name": "current_date",
      "parameters": [
        {
          "key": "format",
          "value": "YYYY-MM-DD"
        }
      ]
    },
    {
      "name": "fhir_server",
      "url": "http://mcp-fhir-agent-dev:5000/",
      "auth": "jwt_token",
      "auth_providers": [
        "oktafhirdev"
      ]
    }
  ],
  "example_prompts": [
    {
      "role": "user",
      "content": "Summarize the contents of the file at this URL: https://drive.google.com/file/d/1a2b3c4d5e6f7g8h9i0j/view?usp=sharing"
    }
  ]
}
