{
  "$schema": "https://raw.githubusercontent.com/imranq2/language_model_gateway/main/language_model_gateway/configs/config_schema.json",
  "id": "development_tools",
  "name": "Development Tools",
  "description": "This model allows searching pull requests across repos, getting git diff and getting issues from Jira.",
  "owner": "Imran Qureshi",
  "system_prompts": [
    {
      "role": "system",
      "content": "You are an agent that can search pull requests across repos and get git diff."
    }
  ],
  "example_prompts": [
    {
      "role": "user",
      "content": "start"
    }
  ],
  "tools": [
    {
      "name": "current_date"
    },
    {
      "name": "github_pull_request_analyzer"
    },
    {
      "name": "github_pull_request_diff"
    },
    {
      "name": "jira_issues_analyzer"
    }
  ]
}